{
  "breaks": [
    {
      "a_row_ids": [],
      "amount_a": 0.0,
      "amount_b": 349.79,
      "b_row_ids": [
        "B5011D"
      ],
      "break_id": "P-001",
      "break_type": "DUPLICATE",
      "component_causes": [
        "DUPLICATE"
      ],
      "confidence": "HIGH",
      "difference": 0.0,
      "evidence": "B5011D (gross 349.79, fee 3.50, net 346.29) is an exact duplicate of B5011. No corresponding row exists in Source A for this duplicate. Source A contains only one legitimate entry for RMT-48505 (A1011).",
      "suggested_action": "Remove duplicate row B5011D from partner statement. If the transaction was legitimately processed twice, investigate and reconcile separately."
    },
    {
      "a_row_ids": [],
      "amount_a": 0.0,
      "amount_b": 972.26,
      "b_row_ids": [
        "B5012D"
      ],
      "break_id": "P-002",
      "break_type": "DUPLICATE",
      "component_causes": [
        "DUPLICATE"
      ],
      "confidence": "HIGH",
      "difference": 0.0,
      "evidence": "B5012D (gross 972.26, fee 9.72, net 962.54) is an exact duplicate of B5012. No corresponding row exists in Source A for this duplicate. Source A contains only one legitimate entry for TXN-48061 (A1012).",
      "suggested_action": "Remove duplicate row B5012D from partner statement. If the transaction was legitimately processed twice, investigate and reconcile separately."
    }
  ],
  "case_id": "case_10_duplicates",
  "matches": [
    {
      "a_row_id": "A1001",
      "b_row_id": "B5001"
    },
    {
      "a_row_id": "A1002",
      "b_row_id": "B5002"
    },
    {
      "a_row_id": "A1003",
      "b_row_id": "B5003"
    },
    {
      "a_row_id": "A1004",
      "b_row_id": "B5004"
    },
    {
      "a_row_id": "A1005",
      "b_row_id": "B5005"
    },
    {
      "a_row_id": "A1006",
      "b_row_id": "B5006"
    },
    {
      "a_row_id": "A1007",
      "b_row_id": "B5007"
    },
    {
      "a_row_id": "A1008",
      "b_row_id": "B5008"
    },
    {
      "a_row_id": "A1009",
      "b_row_id": "B5009"
    },
    {
      "a_row_id": "A1010",
      "b_row_id": "B5010"
    },
    {
      "a_row_id": "A1011",
      "b_row_id": "B5011"
    },
    {
      "a_row_id": "A1012",
      "b_row_id": "B5012"
    }
  ],
  "schema_version": "1.0",
  "system": {
    "model": "gpt-4o",
    "name": "baseline-v1",
    "provider": "openai"
  }
}
