{
  "breaks": [
    {
      "a_row_ids": [
        "A1011"
      ],
      "amount_a": 353.57,
      "amount_b": 353.56,
      "b_row_ids": [
        "B5011"
      ],
      "break_id": "P-001",
      "break_type": "ROUNDING_DIFFERENCE",
      "confidence": "HIGH",
      "difference": 0.01,
      "evidence": "Rows A1011/B5011: gross A 353.57 vs B 353.56 (delta 0.01). Net A 350.03 vs B 350.02 (delta 0.01).",
      "suggested_action": "Accept within tolerance and book to the rounding variance account."
    },
    {
      "a_row_ids": [
        "A1012"
      ],
      "amount_a": 297.41,
      "amount_b": 297.4,
      "b_row_ids": [
        "B5012"
      ],
      "break_id": "P-002",
      "break_type": "ROUNDING_DIFFERENCE",
      "confidence": "HIGH",
      "difference": 0.01,
      "evidence": "Rows A1012/B5012: gross A 297.41 vs B 297.40 (delta 0.01). Net A 294.44 vs B 294.43 (delta 0.01).",
      "suggested_action": "Accept within tolerance and book to the rounding variance account."
    }
  ],
  "case_id": "case_09_rounding",
  "matches": [
    {
      "a_row_id": "A1001",
      "b_row_id": "B5001"
    },
    {
      "a_row_id": "A1002",
      "b_row_id": "B5002"
    },
    {
      "a_row_id": "A1003",
      "b_row_id": "B5003"
    },
    {
      "a_row_id": "A1004",
      "b_row_id": "B5004"
    },
    {
      "a_row_id": "A1005",
      "b_row_id": "B5005"
    },
    {
      "a_row_id": "A1006",
      "b_row_id": "B5006"
    },
    {
      "a_row_id": "A1007",
      "b_row_id": "B5007"
    },
    {
      "a_row_id": "A1008",
      "b_row_id": "B5008"
    },
    {
      "a_row_id": "A1009",
      "b_row_id": "B5009"
    },
    {
      "a_row_id": "A1010",
      "b_row_id": "B5010"
    }
  ],
  "schema_version": "1.0",
  "system": {
    "model": "minimax/minimax-m2.7",
    "name": "agent-v1",
    "provider": "openrouter"
  }
}
